{
  "formatVersion": 1,
  "mode": "quality",
  "status": "pass",
  "startedAt": "2026-09-28T07:12:48.5568616+00:00",
  "completedAt": "2026-09-28T07:15:24.0393200+00:00",
  "inputHash": "01fff32a018dda755c8c19ac6c8e9aae2e789736067c3da8ff398f6587bc0cf7",
  "reason": null,
  "checks": [
    {
      "id": "quality-solution",
      "status": "pass",
      "reason": null,
      "evidencePaths": [
        "artifacts/guards/p10-ifx-115/t8-quality-solution/quality/summary.json"
      ]
    }
  ]
}
